{
    "$id": "tradetrust/v1.0",
    "$schema": "http://json-schema.org/draft-07/schema#",
    "type": "object",
    "properties": {
      "id": {
        "type": "string"
      },
      "$template": {
        "type": "object",
        "properties": {
            "name": {
              "type": "string"
            },
            "type": {
              "type": "string"
            },
            "url": {
              "type": "string"
            }
          },
          "required": [ "name", "type", "url" ]
      },
      "description": {
        "type": "string"
      },
      "issuedOn": {
        "description": "The date that this certificate was issued by the issuer(s)",
        "type": "string",
        "format": "date-time"
      },
      "certificateType": {
        "type": "string"
      },
      "issuers": {
        "type": "array",
        "items": {
          "type": "object",
          "properties": {
            "name": {
              "type": "string"
            },
            "address": {
              "type": "string"
            },
            "country": {
              "type": "string"
            },
            "email": {
              "type": "string",
              "format": "email"
            },
            "phone": {
              "type": "string"
            },
            "certificateStore": {
              "type": "string"
            }
          },
          "required": ["name", "certificateStore"],
          "additionalProperties": true
        },
        "minItems": 1
      },
      "recipient": {
        "type": "object",
        "properties": {
          "name": {
            "type": "string"
          },
          "address": {
            "type": "string"
          },
          "country": {
            "type": "string"
          },
          "email": {
            "type": "string"
          },
          "phone": {
            "type": "string"
          }
        },
        "additionalProperties": true
      },
      "additionalData": {
        "type": "object"
      }
    },
    "required": ["issuers"],
    "additionalProperties": true
  }